{
  "version": "v0.2.0",
  "module_id": "m1",
  "generated_at": "2026-01-17T19:25:19Z",
  "pointer_pack": {
    "pack_id": "inf1220-m1-pointer-pack",
    "source_path": "control/authority/inf1220_m1_pointer_pack.sanitized.md"
  },
  "objectives": [
    {
      "id": "INF1220-M1-O-01",
      "module_id": "m1",
      "topic": "m1-07",
      "text": "Prerequisites & expected prior knowledge",
      "pointer_anchors": [
        "#pack-m1-07-prerequisites"
      ],
      "math_recalls": [],
      "scope_tags": [
        "inf1220",
        "m1",
        "m1-07"
      ]
    },
    {
      "id": "INF1220-M1-O-02",
      "module_id": "m1",
      "topic": "m1-07",
      "text": "What an algorithm is (definition, properties, examples)",
      "pointer_anchors": [
        "#pack-m1-07-what-is-an-algorithm"
      ],
      "math_recalls": [],
      "scope_tags": [
        "inf1220",
        "m1",
        "m1-07"
      ]
    },
    {
      "id": "INF1220-M1-O-03",
      "module_id": "m1",
      "topic": "m1-07",
      "text": "What pseudocode is (purpose, conventions, readability)",
      "pointer_anchors": [
        "#pack-m1-07-what-is-pseudocode"
      ],
      "math_recalls": [],
      "scope_tags": [
        "inf1220",
        "m1",
        "m1-07"
      ]
    },
    {
      "id": "INF1220-M1-O-04",
      "module_id": "m1",
      "topic": "m1-07",
      "text": "Variables and values (assignment, initialization, basic types)",
      "pointer_anchors": [
        "#pack-m1-07-variables-and-values"
      ],
      "math_recalls": [],
      "scope_tags": [
        "inf1220",
        "m1",
        "m1-07"
      ]
    },
    {
      "id": "INF1220-M1-O-05",
      "module_id": "m1",
      "topic": "m1-07",
      "text": "Boolean logic (true/false, AND/OR/NOT, precedence, parentheses)",
      "pointer_anchors": [
        "#pack-m1-07-boolean-logic"
      ],
      "math_recalls": [
        {
          "id": "MATH-REC-M1-07-01",
          "topic": "propositions & truth tables (formal basis for AND/OR/NOT)",
          "minimal_statement": "See pointer-pack anchor (sanitized).",
          "why_needed": "Prerequisite for conditions/sets/relations used in this topic.",
          "pointer_anchor": "#pack-math-logic"
        },
        {
          "id": "MATH-REC-M1-07-02",
          "topic": "implication / equivalence as “spec language” for conditions",
          "minimal_statement": "See pointer-pack anchor (sanitized).",
          "why_needed": "Prerequisite for conditions/sets/relations used in this topic.",
          "pointer_anchor": "#pack-m1-07-boolean-logic"
        }
      ],
      "scope_tags": [
        "inf1220",
        "m1",
        "m1-07"
      ]
    },
    {
      "id": "INF1220-M1-O-06",
      "module_id": "m1",
      "topic": "m1-07",
      "text": "Conditionals in pseudocode (IF / THEN / ELSE / END IF)",
      "pointer_anchors": [
        "#pack-m1-07-boolean-logic"
      ],
      "math_recalls": [
        {
          "id": "MATH-REC-M1-07-01",
          "topic": "binary relations (equivalence, order) as the model for comparisons/tests",
          "minimal_statement": "See pointer-pack anchor (sanitized).",
          "why_needed": "Prerequisite for conditions/sets/relations used in this topic.",
          "pointer_anchor": "#pack-math-logic"
        }
      ],
      "scope_tags": [
        "inf1220",
        "m1",
        "m1-07"
      ]
    },
    {
      "id": "INF1220-M1-O-07",
      "module_id": "m1",
      "topic": "m1-07",
      "text": "Programmer notation (symbolic operators: &&, ||, !)",
      "pointer_anchors": [
        "#pack-m1-07-programmer-notation"
      ],
      "math_recalls": [],
      "scope_tags": [
        "inf1220",
        "m1",
        "m1-07"
      ]
    },
    {
      "id": "INF1220-M1-O-08",
      "module_id": "m1",
      "topic": "m1-07",
      "text": "Loops (iteration, counters, termination conditions)",
      "pointer_anchors": [
        "#pack-m1-07-boolean-logic"
      ],
      "math_recalls": [],
      "scope_tags": [
        "inf1220",
        "m1",
        "m1-07"
      ]
    },
    {
      "id": "INF1220-M1-O-09",
      "module_id": "m1",
      "topic": "m1-07",
      "text": "Arrays (indexing concept, 0-based vs 1-based, access by index)",
      "pointer_anchors": [
        "#pack-m1-07-array"
      ],
      "math_recalls": [],
      "scope_tags": [
        "inf1220",
        "m1",
        "m1-07"
      ]
    },
    {
      "id": "INF1220-M1-O-10",
      "module_id": "m1",
      "topic": "m1-07",
      "text": "Accumulator pattern (sum/average over an array)",
      "pointer_anchors": [
        "#pack-m1-07-array"
      ],
      "math_recalls": [],
      "scope_tags": [
        "inf1220",
        "m1",
        "m1-07"
      ]
    },
    {
      "id": "INF1220-M1-O-11",
      "module_id": "m1",
      "topic": "m1-07",
      "text": "Flowchart ↔ pseudocode mapping (average example)",
      "pointer_anchors": [
        "#pack-m1-07-average-example"
      ],
      "math_recalls": [],
      "scope_tags": [
        "inf1220",
        "m1",
        "m1-07"
      ]
    },
    {
      "id": "INF1220-M1-O-12",
      "module_id": "m1",
      "topic": "m1-07",
      "text": "Translating pseudocode to real code (Java example)",
      "pointer_anchors": [
        "#pack-m1-07-average-example"
      ],
      "math_recalls": [],
      "scope_tags": [
        "inf1220",
        "m1",
        "m1-07"
      ]
    },
    {
      "id": "INF1220-M1-O-13",
      "module_id": "m1",
      "topic": "m1-08",
      "text": "Designing an algorithm (problem analysis: inputs, outputs, processing)",
      "pointer_anchors": [
        "#pack-m1-08-design"
      ],
      "math_recalls": [
        {
          "id": "MATH-REC-M1-08-01",
          "topic": "sets as input/output domains (∅, membership, cardinality)",
          "minimal_statement": "See pointer-pack anchor (sanitized).",
          "why_needed": "Prerequisite for conditions/sets/relations used in this topic.",
          "pointer_anchor": "#pack-math-sets"
        }
      ],
      "scope_tags": [
        "inf1220",
        "m1",
        "m1-08"
      ]
    },
    {
      "id": "INF1220-M1-O-14",
      "module_id": "m1",
      "topic": "m1-08",
      "text": "Algorithm syntax (structuring pseudocode)",
      "pointer_anchors": [
        "#pack-m1-08-syntax"
      ],
      "math_recalls": [],
      "scope_tags": [
        "inf1220",
        "m1",
        "m1-08"
      ]
    },
    {
      "id": "INF1220-M1-O-15",
      "module_id": "m1",
      "topic": "m1-08",
      "text": "Inputs, variables, and outputs (algorithm interface)",
      "pointer_anchors": [
        "#pack-m1-08-io"
      ],
      "math_recalls": [
        {
          "id": "MATH-REC-M1-08-01",
          "topic": "cartesian product (A×B) for paired inputs/outputs (tuples)",
          "minimal_statement": "See pointer-pack anchor (sanitized).",
          "why_needed": "Prerequisite for conditions/sets/relations used in this topic.",
          "pointer_anchor": "#pack-m1-08-io"
        }
      ],
      "scope_tags": [
        "inf1220",
        "m1",
        "m1-08"
      ]
    },
    {
      "id": "INF1220-M1-O-16",
      "module_id": "m1",
      "topic": "m1-08",
      "text": "Operations (arithmetic, comparison, assignment)",
      "pointer_anchors": [
        "#pack-m1-08-operations"
      ],
      "math_recalls": [
        {
          "id": "MATH-REC-M1-08-01",
          "topic": "order relations (≤, <, ≥, >) and their properties (used in bounds/tests)",
          "minimal_statement": "See pointer-pack anchor (sanitized).",
          "why_needed": "Prerequisite for conditions/sets/relations used in this topic.",
          "pointer_anchor": "#pack-math-relations"
        },
        {
          "id": "MATH-REC-M1-08-02",
          "topic": "number sets (ℕ, ℤ, ℚ, ℝ) as “legal value spaces” for variables",
          "minimal_statement": "See pointer-pack anchor (sanitized).",
          "why_needed": "Prerequisite for conditions/sets/relations used in this topic.",
          "pointer_anchor": "#pack-math-sets"
        },
        {
          "id": "MATH-REC-M1-08-03",
          "topic": "Euclidean division / remainder (mod) for divisibility tests (TP1-style logic)",
          "minimal_statement": "See pointer-pack anchor (sanitized).",
          "why_needed": "Prerequisite for conditions/sets/relations used in this topic.",
          "pointer_anchor": "#pack-math-numbers"
        }
      ],
      "scope_tags": [
        "inf1220",
        "m1",
        "m1-08"
      ]
    },
    {
      "id": "INF1220-M1-O-17",
      "module_id": "m1",
      "topic": "m1-08",
      "text": "Worked example: count vowels in a typed word",
      "pointer_anchors": [
        "#pack-m1-08-example-vowels"
      ],
      "math_recalls": [],
      "scope_tags": [
        "inf1220",
        "m1",
        "m1-08"
      ]
    },
    {
      "id": "INF1220-M1-O-18",
      "module_id": "m1",
      "topic": "m1-09",
      "text": "Jump (goto) and labels (conceptual; generally avoided in modern style)",
      "pointer_anchors": [
        "#pack-m1-09-jump"
      ],
      "math_recalls": [],
      "scope_tags": [
        "inf1220",
        "m1",
        "m1-09"
      ]
    },
    {
      "id": "INF1220-M1-O-19",
      "module_id": "m1",
      "topic": "m1-09",
      "text": "Branching as a control structure (conditional jumps / IF logic)",
      "pointer_anchors": [
        "#pack-m1-09-jump"
      ],
      "math_recalls": [],
      "scope_tags": [
        "inf1220",
        "m1",
        "m1-09"
      ]
    },
    {
      "id": "INF1220-M1-O-20",
      "module_id": "m1",
      "topic": "m1-09",
      "text": "Loop as a control structure (repetition patterns)",
      "pointer_anchors": [
        "#pack-m1-09-loop"
      ],
      "math_recalls": [],
      "scope_tags": [
        "inf1220",
        "m1",
        "m1-09"
      ]
    },
    {
      "id": "INF1220-M1-O-21",
      "module_id": "m1",
      "topic": "m1-09",